{
  "$schema": "https://json-schema.org/draft/2020-12/schema",
  "$id": "https://your-registry/schemas/extension/v2.json",
  "title": "Extension manifest v2 (libs/manifest — single source of truth)",
  "description": "Adds three contract flexes over v1: entrypoint optional/typed, runtime expanded to {node,shell,python,declarative,stdio-any}, install-target for declarative host-placement.",
  "type": "object",
  "additionalProperties": true,
  "required": [
    "id",
    "type",
    "title",
    "description",
    "compatibility",
    "license"
  ],
  "properties": {
    "$schema": {
      "type": "string"
    },
    "id": {
      "type": "string",
      "pattern": "^[a-z][a-z0-9-]*$",
      "description": "Stable slug; primary registry key; immutable once published."
    },
    "version": {
      "type": "string",
      "pattern": "^\\d+\\.\\d+\\.\\d+(?:-[0-9A-Za-z-.]+)?(?:\\+[0-9A-Za-z-.]+)?$",
      "deprecated": true,
      "description": "DEPRECATED (ADR-0003): not an identity input. Identity is id + content checksum. Optional, display-only label; if present must be valid semver. Will be removed."
    },
    "type": {
      "type": "string",
      "enum": [
        "agent",
        "skill",
        "mcp-server",
        "prompt",
        "hook",
        "command",
        "bundle",
        "service"
      ],
      "description": "Extension type. Closed enum."
    },
    "title": {
      "type": "string",
      "minLength": 1
    },
    "description": {
      "type": "string",
      "minLength": 1
    },
    "compatibility": {
      "type": "object",
      "description": "Host compatibility requirements. Accepts any shape (host or soxe key).",
      "additionalProperties": true
    },
    "license": {
      "type": "string"
    },
    "entrypoint": {
      "type": "string",
      "description": "[flex:entrypoint-optional] Optional. Absent for bundle, prompt, and declarative types."
    },
    "runtime": {
      "type": "string",
      "enum": [
        "node",
        "shell",
        "python",
        "declarative",
        "stdio-any"
      ],
      "description": "[flex:runtime-expanded] 'node'|'shell'|'python'|'declarative'|'stdio-any'. Absent => 'node'."
    },
    "install-target": {
      "type": "string",
      "description": "[flex:install-target] Optional host-placement path for declarative extensions."
    },
    "keywords": {
      "type": "array",
      "items": {
        "type": "string"
      }
    },
    "author": {
      "oneOf": [
        {
          "type": "string"
        },
        {
          "type": "object",
          "additionalProperties": false,
          "required": [
            "name"
          ],
          "properties": {
            "name": {
              "type": "string"
            },
            "email": {
              "type": "string"
            },
            "url": {
              "type": "string"
            }
          }
        }
      ]
    },
    "homepage": {
      "type": "string"
    },
    "repository": {
      "type": "string"
    },
    "private": {
      "type": "boolean"
    },
    "checksum": {
      "type": "string"
    },
    "order": {
      "type": "integer"
    },
    "tags": {
      "type": "array",
      "items": {
        "type": "string"
      }
    },
    "requires": {
      "type": "object",
      "additionalProperties": false,
      "properties": {
        "tool_calling": {
          "type": "boolean"
        },
        "structured_output": {
          "type": "boolean"
        },
        "min_context_tokens": {
          "type": "integer",
          "minimum": 1
        }
      }
    },
    "dependencies": {
      "type": "array",
      "items": {
        "oneOf": [
          {
            "type": "string"
          },
          {
            "type": "object",
            "additionalProperties": false,
            "required": [
              "id",
              "version"
            ],
            "properties": {
              "id": {
                "type": "string"
              },
              "version": {
                "type": "string"
              }
            }
          }
        ]
      }
    },
    "capabilities": {
      "type": "array",
      "items": {
        "type": "string"
      }
    },
    "members": {
      "type": "array",
      "items": {
        "type": "object",
        "additionalProperties": true,
        "required": [
          "id"
        ],
        "properties": {
          "id": {
            "type": "string"
          }
        }
      }
    },
    "lifecycle": {
      "type": "object",
      "additionalProperties": false,
      "properties": {
        "background": {
          "type": "boolean"
        },
        "singleton": {
          "type": "boolean"
        },
        "stop_timeout_ms": {
          "type": "integer",
          "minimum": 0
        },
        "health": {
          "type": "object",
          "additionalProperties": false,
          "properties": {
            "type": {
              "enum": [
                "stdio-ping",
                "http-get",
                "socket",
                "command"
              ]
            },
            "endpoint": {
              "type": "string"
            },
            "interval_ms": {
              "type": "integer",
              "minimum": 250
            },
            "timeout_ms": {
              "type": "integer",
              "minimum": 100
            }
          }
        }
      }
    },
    "events": {
      "type": "array",
      "items": {
        "type": "string"
      },
      "minItems": 1
    },
    "invocation": {
      "type": "object",
      "additionalProperties": false,
      "properties": {
        "protocol": {
          "type": "string",
          "enum": [
            "function-export",
            "stdio",
            "ipc",
            "http"
          ]
        },
        "handler": {
          "type": "string"
        },
        "input_schema": {
          "type": "object",
          "additionalProperties": true
        },
        "output_schema": {
          "type": "object",
          "additionalProperties": true
        },
        "description": {
          "type": "string"
        }
      }
    },
    "tools": {
      "type": "array",
      "items": {
        "type": "object",
        "additionalProperties": false,
        "required": [
          "name",
          "description"
        ],
        "properties": {
          "name": {
            "type": "string"
          },
          "description": {
            "type": "string"
          },
          "inputSchema": {
            "type": "object",
            "additionalProperties": true
          }
        }
      }
    },
    "parameters": {
      "type": "array",
      "items": {
        "type": "object",
        "additionalProperties": false,
        "required": [
          "name"
        ],
        "properties": {
          "name": {
            "type": "string"
          },
          "type": {
            "type": "string",
            "enum": [
              "string",
              "number",
              "boolean",
              "array",
              "object"
            ]
          },
          "required": {
            "type": "boolean"
          },
          "description": {
            "type": "string"
          }
        }
      }
    },
    "template_engine": {
      "type": "string",
      "enum": [
        "handlebars",
        "jinja2",
        "mustache",
        "simple",
        "none"
      ]
    },
    "run_interface": {
      "type": "object",
      "additionalProperties": false,
      "properties": {
        "input_schema": {
          "type": "object",
          "additionalProperties": true
        },
        "output_schema": {
          "type": "object",
          "additionalProperties": true
        }
      }
    },
    "config_schema": {
      "type": "object",
      "additionalProperties": true
    },
    "permissions": {
      "type": "object",
      "additionalProperties": false,
      "properties": {
        "fs": {
          "type": "object",
          "additionalProperties": false,
          "properties": {
            "read": {
              "type": "array",
              "items": {
                "type": "string"
              }
            },
            "write": {
              "type": "array",
              "items": {
                "type": "string"
              }
            }
          }
        },
        "network": {
          "type": "object",
          "additionalProperties": false,
          "properties": {
            "outbound": {
              "type": "array",
              "items": {
                "type": "string"
              }
            }
          }
        },
        "socket": {
          "type": "object",
          "additionalProperties": false,
          "properties": {
            "paths": {
              "type": "array",
              "items": {
                "type": "string"
              }
            }
          }
        }
      }
    },
    "install": {
      "type": "object",
      "description": "[shape:install-descriptor] Hybrid install descriptor. Engine fills per-host defaults from libs/host-registry.",
      "additionalProperties": true,
      "properties": {
        "type": {
          "type": "string",
          "enum": [
            "agent",
            "skill",
            "mcp-server",
            "prompt",
            "hook",
            "command",
            "bundle",
            "service"
          ]
        },
        "hosts": {
          "type": "array",
          "items": {
            "type": "string",
            "enum": [
              "claude",
              "codex",
              "opencode",
              "agent-mcp"
            ]
          }
        },
        "profiles": {
          "type": "object",
          "additionalProperties": true
        },
        "serves": {
          "type": "array",
          "items": {
            "type": "string",
            "enum": [
              "stdio",
              "sse",
              "http"
            ]
          }
        },
        "transports": {
          "type": "array",
          "items": {
            "type": "string",
            "enum": [
              "stdio",
              "http",
              "sse",
              "socket"
            ]
          }
        },
        "source": {
          "type": "string"
        },
        "overrides": {
          "type": "object",
          "additionalProperties": true
        }
      }
    },
    "agent": {
      "type": "object",
      "additionalProperties": false,
      "description": "[def:agent-ir] Host-agnostic agent IR. Rendered into a per-host header at install time by libs/host-registry.",
      "properties": {
        "name": {
          "type": "string"
        },
        "description": {
          "type": "string"
        },
        "model": {
          "type": "string"
        },
        "temperature": {
          "type": "number"
        },
        "mode": {
          "type": "string"
        },
        "steps": {
          "type": "number"
        },
        "tools": {
          "type": "array",
          "items": {
            "oneOf": [
              {
                "type": "string"
              },
              {
                "type": "object",
                "additionalProperties": false,
                "required": [
                  "logical",
                  "server"
                ],
                "properties": {
                  "logical": {
                    "type": "string"
                  },
                  "server": {
                    "type": "string"
                  }
                }
              }
            ]
          }
        },
        "permission": {
          "type": "object",
          "additionalProperties": true,
          "description": "opencode agent-frontmatter permission map: action | (pattern -> action). Shape-checked by validate()."
        }
      }
    },
    "render": {
      "type": "object",
      "additionalProperties": false,
      "description": "[def:agent-render-overrides] Per-host typed overrides merged over the agent IR at install time.",
      "properties": {
        "claude": {
          "type": "object",
          "additionalProperties": true
        },
        "opencode": {
          "type": "object",
          "additionalProperties": true
        },
        "codex": {
          "type": "object",
          "additionalProperties": true
        },
        "agent-mcp": {
          "type": "object",
          "additionalProperties": true
        }
      }
    },
    "config": {
      "type": "object",
      "additionalProperties": true
    },
    "source": {
      "type": "string",
      "description": "[def:source-provenance] Top-level provenance path."
    }
  }
}
