{
  "$schema": "https://your-registry/schemas/extension/v1.json",
  "id": "sox-memory",
  "version": "0.1.0",
  "type": "skill",
  "title": "Using the sox memory system",
  "description": "Use when an agent should recall prior knowledge or store durable findings in the sox graph-memory system via the memory_* MCP tools (memory_recall / memory_write / memory_search_entities / memory_invalidate).",
  "keywords": ["memory", "recall", "embeddings", "graph", "mcp", "knowledge"],
  "author": "sox-ecosystem",
  "compatibility": {
    "host": ">=1.0.0 <2.0.0"
  },
  "license": "MIT",
  "runtime": "declarative",
  "entrypoint": "SKILL.md",
  "run_interface": {
    "input_schema": { "type": "object", "properties": {} },
    "output_schema": { "type": "object", "properties": {} }
  },
  "install": {
    "type": "skill",
    "hosts": ["claude"]
  }
}
