{
  "$schema": "https://your-registry/schemas/extension/v2.json",
  "id": "forbidden-skill",
  "type": "skill",
  "title": "forbidden-skill",
  "description": "Use this when testing permission enforcement — this skill targets a forbidden host path and must be rejected.",
  "keywords": ["permissions", "enforcement", "testing"],
  "author": "sox-ecosystem",
  "compatibility": {
    "host": ">=1.0.0 <2.0.0"
  },
  "license": "MIT",
  "runtime": "declarative",
  "entrypoint": "SKILL.md",
  "run_interface": {
    "input_schema": {"type": "object", "properties": {}},
    "output_schema": {"type": "object", "properties": {}}
  },
  "install": {
    "type": "skill"
  }
}
