{
  "$schema": "https://your-registry/schemas/extension/v1.json",
  "id": "status",
  "version": "0.1.0",
  "type": "command",
  "title": "Status Command",
  "description": "Use this when you want a quick snapshot of the runtime environment — reports node version, cwd, and platform via /status-command without making any LLM calls.",
  "keywords": ["status", "environment", "diagnostic", "reference", "command"],
  "author": "sox-ecosystem",
  "compatibility": {
    "host": ">=1.0.0 <2.0.0"
  },
  "license": "MIT",
  "entrypoint": "dist/index.js",
  "invocation": {
    "protocol": "function-export",
    "handler": "run",
    "description": "Call run(input: CommandInput) → CommandOutput. CommandInput: { args: string[] }. CommandOutput: { stdout: string, exitCode: number }. Invoked via /status-command slash command."
  },
  "config_schema": {
    "type": "object",
    "additionalProperties": false,
    "properties": {},
    "description": "Status command accepts no configuration."
  },
  "permissions": {}
}
