{
  "$schema": "https://your-registry/schemas/extension/v2.json",
  "id": "doc-reviewer",
  "version": "0.1.5",
  "type": "agent",
  "title": "doc-reviewer",
  "description": "Use this when you need the assessment gate for the documentation trio. After the steward rewrites a scope's doc surface, this agent decides PASS/FAIL on three teeth-having lenses: (1) closed-loop metric — the re-run cartographer catalog must show metric #1 (eliminated reader searches) and undocumented/junk DROP vs the pre-rewrite baseline, with zero capabilities.json contradictions; (2) rubric/template conformance — every doc matches its deterministic skeleton recalled from memory and every README claim resolves to a shipped receipt; (3) fresh-agent consumer test — dispatches doc-consumer to complete canonical tasks using ONLY the docs. Writes a scored verdict to .catalog/review.md. Never edits the docs it judges.",
  "compatibility": {
    "host": ">=1.0.0 <2.0.0"
  },
  "license": "MIT",
  "author": "sox-ecosystem",
  "keywords": [
    "doc-reviewer",
    "agent",
    "declarative"
  ],
  "runtime": "declarative",
  "entrypoint": "doc-reviewer.md",
  "invocation": {
    "protocol": "function-export",
    "handler": "run",
    "description": "Declarative agent — host reads the prose body and renders the host header from agent/render at install time."
  },
  "agent": {
    "name": "doc-reviewer",
    "description": "Assessment gate for the documentation trio. After the steward rewrites a scope's doc surface, this agent decides PASS/FAIL on three teeth-having lenses: (1) closed-loop metric — the re-run cartographer catalog must show metric #1 (eliminated reader searches) and undocumented/junk DROP vs the pre-rewrite baseline, with zero capabilities.json contradictions; (2) rubric/template conformance — every doc matches its deterministic skeleton recalled from memory and every README claim resolves to a shipped receipt; (3) fresh-agent consumer test — dispatches doc-consumer to complete canonical tasks using ONLY the docs. Writes a scored verdict to .catalog/review.md. Never edits the docs it judges.",
    "model": "haiku",
    "temperature": 0.1,
    "mode": "subagent",
    "steps": 40,
    "tools": [
      "read",
      "edit",
      "glob",
      "grep",
      "todowrite",
      {
        "logical": "memory",
        "server": "memory-server"
      }
    ],
    "permission": {
      "read": "allow",
      "edit": "allow",
      "glob": "allow",
      "grep": "allow",
      "webfetch": "deny",
      "websearch": "deny",
      "task": "deny",
      "todowrite": "allow",
      "question": "deny",
      "skill": "deny",
      "memory_*": "allow",
      "bash": {
        "*": "allow",
        "rm *": "deny",
        "git push*": "deny",
        "git reset --hard*": "deny",
        "git stash*": "deny",
        "git add -A*": "deny",
        "git add .": "deny",
        "git add --all*": "deny",
        "git push *--no-verify*": "ask",
        "git clean *-f*": "deny",
        "git checkout -- *": "ask",
        "rm -rf *": "ask",
        "*dot/secrets*": "deny"
      }
    }
  },
  "render": {
    "claude": {
      "model": "haiku",
      "version": "v0.1.5",
      "tools": [
        "Read",
        "Edit",
        "Glob",
        "Grep",
        "Bash",
        "mcp__memory-server__*"
      ]
    },
    "opencode": {
      "model": "deepseek/deepseek-flash",
      "mode": "subagent",
      "temperature": 0.1
    },
    "agent-mcp": {
      "model": "deepseek/deepseek-flash",
      "mcpServers": {
        "agent": {
          "transport": "stdio",
          "command": "npx",
          "args": [
            "-y",
            "@adhd/agent-mcp@latest"
          ],
          "env": {
            "ADHD_AGENT_DATABASE_PATH": "/Users/nix/.adhd/agent-mcp/agents.db",
            "ADHD_AGENT_REGISTRY_DB_PATH": "/Users/nix/.adhd/agent-mcp/registry.db"
          }
        },
        "search": {
          "transport": "stdio",
          "command": "node",
          "args": [
            "/Users/nix/dev/ai/scratch/agent-browser/server.mjs",
            "--transport",
            "stdio",
            "--ns",
            "agent",
            "--drop-file-segment"
          ]
        },
        "memory-server": {
          "transport": "sse",
          "url": "http://localhost:3099/sse",
          "timeoutMs": 40000
        },
        "gitnexus": {
          "transport": "stdio",
          "command": "/Users/nix/.local/bin/gitnexus-singleton.sh",
          "args": []
        },
        "backlog": {
          "transport": "stdio",
          "command": "node",
          "args": [
            "/Users/nix/dev/node/adhd/entrypoint/backlog/dist/index.js",
            "serve",
            "--transport",
            "mcp"
          ],
          "timeoutMs": 45000
        }
      }
    }
  },
  "install": {
    "type": "agent",
    "hosts": [
      "claude",
      "opencode",
      "agent-mcp"
    ]
  },
  "requires": {
    "tool_calling": true
  }
}
