{
  "$schema": "https://your-registry/schemas/extension/v2.json",
  "id": "memory-org",
  "version": "0.1.4",
  "type": "agent",
  "title": "org-agent",
  "description": "Use this when you need an agent that organises or retrieves memories scoped to a project or organisation.",
  "keywords": [
    "memory",
    "organisation",
    "agent"
  ],
  "author": "sox-ecosystem",
  "compatibility": {
    "host": ">=1.0.0 <2.0.0"
  },
  "license": "MIT",
  "runtime": "declarative",
  "entrypoint": "org-agent.md",
  "invocation": {
    "protocol": "function-export",
    "handler": "run",
    "description": "Declarative agent — host reads the prose body and renders the host header from agent/render at install time."
  },
  "requires": {
    "tool_calling": true
  },
  "agent": {
    "name": "org-agent",
    "description": "Agent that organises or retrieves memories scoped to a project or organisation.",
    "model": "sonnet",
    "tools": [
      "read",
      "write",
      "edit",
      "bash",
      "glob",
      "grep"
    ],
    "permission": {
      "read": "allow",
      "write": "allow",
      "edit": "allow",
      "bash": {
        "*": "allow",
        "git stash*": "deny",
        "git add -A*": "deny",
        "git add .": "deny",
        "git add --all*": "deny",
        "git reset --hard*": "deny",
        "git push *--no-verify*": "ask",
        "git clean *-f*": "deny",
        "git checkout -- *": "ask",
        "rm -rf *": "ask",
        "*dot/secrets*": "deny"
      },
      "glob": "allow",
      "grep": "allow"
    }
  },
  "render": {
    "claude": {
      "model": "sonnet",
      "version": "v0.1.4"
    },
    "opencode": {
      "model": "deepseek/deepseek-flash",
      "mode": "all"
    },
    "agent-mcp": {
      "model": "deepseek/deepseek-flash",
      "mcpServers": {
        "agent": {
          "transport": "stdio",
          "command": "npx",
          "args": [
            "-y",
            "@adhd/agent-mcp@latest"
          ],
          "env": {
            "ADHD_AGENT_DATABASE_PATH": "/Users/nix/.adhd/agent-mcp/agents.db",
            "ADHD_AGENT_REGISTRY_DB_PATH": "/Users/nix/.adhd/agent-mcp/registry.db"
          }
        },
        "search": {
          "transport": "stdio",
          "command": "node",
          "args": [
            "/Users/nix/dev/ai/scratch/agent-browser/server.mjs",
            "--transport",
            "stdio",
            "--ns",
            "agent",
            "--drop-file-segment"
          ]
        },
        "memory-server": {
          "transport": "sse",
          "url": "http://localhost:3099/sse",
          "timeoutMs": 40000
        },
        "gitnexus": {
          "transport": "stdio",
          "command": "/Users/nix/.local/bin/gitnexus-singleton.sh",
          "args": []
        },
        "backlog": {
          "transport": "stdio",
          "command": "node",
          "args": [
            "/Users/nix/dev/node/adhd/entrypoint/backlog/dist/index.js",
            "serve",
            "--transport",
            "mcp"
          ],
          "timeoutMs": 45000
        }
      }
    }
  },
  "install": {
    "type": "agent",
    "hosts": [
      "claude",
      "opencode",
      "agent-mcp"
    ]
  }
}
