{
  "$schema": "https://your-registry/schemas/extension/v1.json",
  "id": "sox-memory-bundle",
  "version": "0.1.0",
  "type": "bundle",
  "title": "sox-memory (graph memory subsystem)",
  "description": "Use this when you want the full sox-memory graph-memory subsystem installed in one command — expands to memory-daemon (supervised Unix-socket writer daemon), memory-server (7 MCP tools, stdio), memory-flush (SessionEnd hook), and memory-cli (store lifecycle commands).",
  "keywords": ["memory", "bundle", "graph", "rag", "sqlite", "subsystem"],
  "author": "sox-ecosystem",
  "compatibility": { "host": ">=1.0.0 <2.0.0" },
  "license": "MIT",
  "members": [
    { "id": "memory-daemon",  "version": "^0.1.0" },
    { "id": "memory-server",  "version": "^0.1.0" },
    { "id": "memory-flush",   "version": "^0.1.0" },
    { "id": "memory-cli",     "version": "^0.1.0" }
  ],
  "permissions": {}
}
