{
  "$schema": "https://your-registry/schemas/extension/v2.json",
  "id": "git-manager",
  "version": "0.4.1",
  "type": "agent",
  "title": "git-manager",
  "description": "Use when a project's git operations need one owner — worktree creation/removal, branching, merge, push, cleanup — and a per-project, solely-owned git policy document that stays in sync with the repo it governs. Triggers: \"merge this\", \"create a worktree\", \"clean up the worktrees\", \"push this\", \"what's our git workflow\", \"is this worktree safe to remove\".",
  "compatibility": {
    "host": ">=1.0.0 <2.0.0"
  },
  "license": "MIT",
  "author": "sox-ecosystem",
  "keywords": [
    "git",
    "worktree",
    "policy",
    "merge",
    "separation-of-duties",
    "cleanup"
  ],
  "runtime": "declarative",
  "entrypoint": "git-manager.md",
  "invocation": {
    "protocol": "function-export",
    "handler": "run",
    "description": "Declarative agent — host reads the prose body and renders the host header from agent/render at install time."
  },
  "requires": {
    "tool_calling": true
  },
  "agent": {
    "name": "git-manager",
    "description": "Sole owner of git for a project. Performs every git operation (worktree create/remove, branch, merge, push, cleanup), maintains a per-project git policy document it alone owns and keeps in sync, and refuses any operation that would destroy work it did not author or that it cannot verify. Never designs features or writes application code.",
    "model": "sonnet",
    "mode": "all",
    "temperature": 0.2,
    "tools": [
      "read",
      "bash",
      "edit",
      "write",
      "question",
      "skill",
      {
        "logical": "memory",
        "server": "memory-server"
      }
    ],
    "permission": {
      "read": "allow",
      "edit": "allow",
      "write": "allow",
      "bash": {
        "*": "allow",
        "git push --force *": "deny",
        "git push *--force*": "deny",
        "git push *--no-verify*": "deny",
        "git branch -D*": "deny",
        "git reset --hard*": "deny",
        "git clean -f*": "deny",
        "git stash*": "deny",
        "git add -A*": "deny",
        "git add .": "deny",
        "git add --all*": "deny",
        "git clean *-f*": "deny",
        "git checkout -- *": "ask",
        "rm -rf *": "ask",
        "*dot/secrets*": "deny"
      },
      "question": "allow",
      "skill": "allow",
      "memory_*": "allow"
    }
  },
  "render": {
    "claude": {
      "model": "sonnet",
      "version": "v0.4.1",
      "tools": [
        "Read",
        "Bash",
        "Edit",
        "Write",
        "AskUserQuestion",
        "Skill",
        "mcp__memory-server__*"
      ]
    },
    "opencode": {
      "model": "deepseek/deepseek-flash",
      "mode": "all",
      "temperature": 0.2
    },
    "agent-mcp": {
      "model": "deepseek/deepseek-flash",
      "toolMap": {
        "memory": "memory-server",
        "code-intel": "gitnexus",
        "search": "search",
        "backlog": "backlog"
      },
      "mcpServers": {
        "search": {
          "transport": "stdio",
          "command": "node",
          "args": [
            "${HOME}/dev/ai/scratch/agent-browser/server.mjs",
            "--transport",
            "stdio",
            "--ns",
            "agent",
            "--drop-file-segment"
          ]
        },
        "memory-server": {
          "transport": "sse",
          "url": "http://localhost:3099/sse",
          "timeoutMs": 40000
        },
        "gitnexus": {
          "transport": "stdio",
          "command": "npx",
          "args": [
            "-y",
            "gitnexus",
            "mcp"
          ]
        },
        "backlog": {
          "transport": "stdio",
          "command": "npx",
          "args": [
            "-y",
            "--prefer-online=false",
            "@adhd/backlog@latest",
            "serve",
            "--transport",
            "mcp"
          ],
          "timeoutMs": 45000
        }
      }
    }
  },
  "install": {
    "type": "agent",
    "hosts": [
      "claude",
      "opencode",
      "agent-mcp"
    ]
  }
}
