{
  "$schema": "https://your-registry/schemas/extension/v2.json",
  "id": "debug",
  "version": "0.1.7",
  "type": "agent",
  "title": "debug",
  "description": "Use this when you need a senior debugging specialist to diagnose complex software issues, analyze system behavior, and identify root causes from error logs and stack traces. Delegates broad discovery to `researcher` and uses GitNexus-first root-cause tracing instead of blind grepping. Differentiate from `review`: this agent chases a specific reported failure to its root cause; `review` audits code that isn't (yet) known to be broken.",
  "compatibility": {
    "host": ">=1.0.0 <2.0.0"
  },
  "license": "MIT",
  "author": "sox-ecosystem",
  "keywords": [
    "debug",
    "agent",
    "declarative"
  ],
  "runtime": "declarative",
  "entrypoint": "debug.md",
  "invocation": {
    "protocol": "function-export",
    "handler": "run",
    "description": "Declarative agent — host reads the prose body and renders the host header from agent/render at install time."
  },
  "agent": {
    "name": "debug",
    "description": "Senior debugging specialist. Diagnoses complex software issues, analyzes system behavior, and identifies root causes from error logs and stack traces. Delegates broad discovery to `researcher` and uses GitNexus-first root-cause tracing instead of blind grepping. Differentiate from `review`: this agent chases a specific reported failure to its root cause; `review` audits code that isn't (yet) known to be broken.",
    "model": "sonnet",
    "mode": "all",
    "temperature": 0.1,
    "tools": [
      "read",
      "edit",
      "glob",
      "grep",
      "bash",
      "webfetch",
      "task",
      "todowrite",
      "question",
      "skill"
    ],
    "permission": {
      "read": "allow",
      "edit": "allow",
      "glob": "allow",
      "grep": "allow",
      "bash": {
        "*": "allow",
        "npx nx *": "allow",
        "npx gitnexus *": "allow",
        "git status*": "allow",
        "git diff*": "allow",
        "git log*": "allow",
        "git stash*": "deny",
        "git add -A*": "deny",
        "git add .": "deny",
        "git add --all*": "deny",
        "git reset --hard*": "deny",
        "git push --force*": "deny",
        "git push *--no-verify*": "deny",
        "git clean *-f*": "deny",
        "rm -rf *": "deny",
        "git checkout -- *": "ask",
        "*dot/secrets*": "deny"
      },
      "webfetch": "allow",
      "websearch": "deny",
      "task": {
        "*": "deny",
        "researcher": "allow"
      },
      "todowrite": "allow",
      "question": "allow",
      "skill": "allow",
      "memory_*": "allow",
      "gitnexus_*": "allow",
      "mcp__backlog__*": "allow"
    }
  },
  "render": {
    "claude": {
      "model": "sonnet",
      "version": "v0.1.7"
    },
    "opencode": {
      "model": "deepseek/deepseek-flash",
      "mode": "all",
      "temperature": 0.1
    },
    "agent-mcp": {
      "model": "deepseek/deepseek-flash",
      "mcpServers": {
        "agent": {
          "transport": "stdio",
          "command": "npx",
          "args": [
            "-y",
            "@adhd/agent-mcp@latest"
          ],
          "env": {
            "ADHD_AGENT_DATABASE_PATH": "/Users/nix/.adhd/agent-mcp/agents.db",
            "ADHD_AGENT_REGISTRY_DB_PATH": "/Users/nix/.adhd/agent-mcp/registry.db"
          }
        },
        "search": {
          "transport": "stdio",
          "command": "node",
          "args": [
            "/Users/nix/dev/ai/scratch/agent-browser/server.mjs",
            "--transport",
            "stdio",
            "--ns",
            "agent",
            "--drop-file-segment"
          ]
        },
        "memory-server": {
          "transport": "sse",
          "url": "http://localhost:3099/sse",
          "timeoutMs": 40000
        },
        "gitnexus": {
          "transport": "stdio",
          "command": "/Users/nix/.local/bin/gitnexus-singleton.sh",
          "args": []
        },
        "backlog": {
          "transport": "stdio",
          "command": "node",
          "args": [
            "/Users/nix/dev/node/adhd/entrypoint/backlog/dist/index.js",
            "serve",
            "--transport",
            "mcp"
          ],
          "timeoutMs": 45000
        }
      }
    }
  },
  "install": {
    "type": "agent",
    "hosts": [
      "claude",
      "opencode",
      "agent-mcp"
    ]
  },
  "requires": {
    "tool_calling": true
  }
}
